	Unnamed: 0	tweet_textual_content	len	ID	Date	Source	Likes	RTs	polarity
225	225	rt sou f de ines brasil desde q ela dublou x men	91	1140713127069278240	Mon Jun 17 20:09:37 +0000 2019	"<a href=""http://twitter.com/download/android"" rel=""nofollow"">Twitter for Android</a>"	0	18	2
226	226	on tue at pm d men in black international john wick chapter parabellum x men dark phoenix d aladd	140	1140713483325050884	Mon Jun 17 20:11:02 +0000 2019	"<a href=""http://twirssi.com"" rel=""nofollow"">Twirssi</a>"	0	0	2
227	227	matthew vaughn directed kingsman and x men first class film icon	66	1140713315804598272	Mon Jun 17 20:10:22 +0000 2019	"<a href=""http://twitter.com"" rel=""nofollow"">Twitter Web Client</a>"	0	0	2
228	228	algu m a vamo no cinema assistir x men	39	1140712793227845633	Mon Jun 17 20:08:17 +0000 2019	"<a href=""http://twitter.com/download/iphone"" rel=""nofollow"">Twitter for iPhone</a>"	2	0	2
229	229	rt x men evolution	55	1140713782089531394	Mon Jun 17 20:12:13 +0000 2019	"<a href=""http://twitter.com/download/android"" rel=""nofollow"">Twitter for Android</a>"	0	357	2
